{
  "id": "W03-O04",
  "source_id": "W02-S1",
  "target": "Non-text contrast",
  "observed_behavior": "WCAG SC 1.4.11 requires 3:1 contrast for qualifying visual information needed to identify interface components and relevant states, and for graphical objects needed to understand content, with exceptions.",
  "context": "W03 visual hierarchy/composition controlled acquisition; exact cited source scope only",
  "evidence_location": "https://www.w3.org/TR/WCAG22/#non-text-contrast",
  "evidence_kind": "NORMATIVE_TEXT",
  "confidence": "HIGH",
  "limitations": [
    "Does not mean every decorative card stroke or divider must have 3:1 contrast."
  ],
  "observed_at": "2026-10-08T06:11:50.973Z",
  "status": "OBSERVED",
  "domain": "ACCESSIBILITY",
  "source_version_context": "WCAG 2.2 SC 1.4.11 (AA)",
  "contradicted_by": [],
  "notes": "SOURCE INSPECTED only; no recommendation, runtime test or conformance determination"
}
