{
  "id": "W05-O35",
  "source_id": "W05-S6",
  "target": "NavList navigation landmark and name",
  "domain": "SEMANTIC_HTML",
  "observed_behavior": "Pinned NavList.tsx renders a nav landmark with aria-label or heading-based aria-labelledby, and contextual heading levels.",
  "context": "Exact primer/react@7f5303d803986887187d86dcebaeda22a4dc6823 NavList/UnderlineNav/Breadcrumbs code inspection",
  "evidence_location": "https://github.com/primer/react/blob/7f5303d803986887187d86dcebaeda22a4dc6823/packages/react/src/NavList/NavList.tsx",
  "evidence_kind": "SOURCE_CODE",
  "confidence": "HIGH",
  "limitations": [
    "Source code cannot establish correct landmark names in a particular caller."
  ],
  "observed_at": "2026-10-08T08:00:00Z",
  "source_version_context": "primer/react@7f5303d803986887187d86dcebaeda22a4dc6823",
  "status": "OBSERVED",
  "contradicted_by": [],
  "notes": "No tests, browser, keyboard navigation, AT or user study executed"
}
