{
  "id": "W05-O15",
  "source_id": "W05-S2",
  "target": "Headings identify page content structure",
  "domain": "INFORMATION_ARCHITECTURE",
  "observed_behavior": "The WAI Page Structure Headings tutorial organizes content through headings to show hierarchy and support navigation between sections.",
  "context": "First-party W3C WAI explanatory navigation/page-structure tutorial, non-normative",
  "evidence_location": "https://www.w3.org/WAI/tutorials/page-structure/headings/",
  "evidence_kind": "DOCUMENTATION_STATEMENT",
  "confidence": "HIGH",
  "limitations": [
    "A heading hierarchy is not automatically the same as the page-route taxonomy or site map."
  ],
  "observed_at": "2026-10-08T07:56:00Z",
  "source_version_context": "Live WAI tutorial; exact site build not pinned",
  "status": "OBSERVED",
  "contradicted_by": [],
  "notes": "No keyboard/browser/screen-reader execution"
}
