{
  "id": "W02-O09",
  "source_id": "W02-S2",
  "target": "Start-page navigation affordance",
  "observed_behavior": "For service start pages, GOV.UK says start buttons typically do not submit form data and demonstrates a link with an href styled as a start button.",
  "context": "W02 action-controls pilot; documented design-system behavior, not universal recommendation",
  "domain": "SEMANTIC_HTML",
  "evidence_location": "https://design-system.service.gov.uk/components/button/ — Start buttons",
  "evidence_kind": "DOCUMENTATION_STATEMENT",
  "confidence": "HIGH",
  "limitations": [
    "Example includes an anchor with role button; whether role choice affects expected keyboard conventions was not tested here."
  ],
  "observed_at": "2026-10-08T05:33:56.836Z",
  "source_version_context": "GOV.UK live component page",
  "status": "OBSERVED",
  "contradicted_by": [],
  "notes": "Source documentation inspected; no independent end-user usability testing"
}
